<?xml version="1.0" encoding="UTF-8"?>
<!--
  Copyright (C) 2013 Andrei Olaru. See the AUTHORS file for more information.
  
  This file is part of AmIciTy-Mi.
  
  AmIciTy-Mi is free software: you can redistribute it and/or modify it under the terms of the GNU General Public License as published by the Free Software Foundation, either version 3 of the License, or any later version.
  
  AmIciTy-Mi is distributed in the hope that it will be useful, but WITHOUT ANY WARRANTY; without even the implied warranty of MERCHANTABILITY or FITNESS FOR A PARTICULAR PURPOSE.  See the GNU General Public License for more details.
  
  You should have received a copy of the GNU General Public License along with AmIciTy-Mi.  If not, see <http://www.gnu.org/licenses/>.
-->
<scen:scenario 
	xmlns:pr="http://www.example.org/parameterSchema"
	xmlns:kb="http://www.example.org/kbSchema" 
	xmlns:scen="http://www.example.org/scenarioSchema"
	xmlns:xsi="http://www.w3.org/2001/XMLSchema-instance"
	xsi:schemaLocation="http://www.example.org/scenarioSchema ./scenarioSchema2.xsd ">

	<scen:jadeConfig mainContainerName="ContainerRoot" />
	<scen:adfPath>scenario/examples/simpleScenarioC</scen:adfPath>
	<scen:agentPackage>agent_packages.example</scen:agentPackage>

	<scen:initial>
		<scen:container name="ContainerRoot">
			<scen:agent>
				<scen:parameter name="loader" value="adf2" />
				<scen:parameter name="class" value="UnitaryAgent" />
				<scen:parameter name="name" value="root" />
				<scen:parameter name="java-code" value="StringFunctions" />
			</scen:agent>
			<scen:agent>
				<scen:parameter name="loader" value="adf2" />
				<scen:parameter name="class" value="UnitaryAgent" />
				<scen:parameter name="name" value="master" />
				<scen:parameter name="parent" value="root" />
			</scen:agent>
		</scen:container>

		<scen:container name="ContainerRoaming">
			<scen:agent>
				<scen:parameter name="loader" value="adf2" />
				<scen:parameter name="class" value="UnitaryAgent" />
				<scen:parameter name="name" value="roaming" />
				<scen:parameter name="parent" value="root" />
				<scen:parameter name="java-code" value="StringFunctions" />
			</scen:agent>
			<scen:agent>
				<scen:parameter name="loader" value="adf2" />
				<scen:parameter name="class" value="UnitaryAgent" />
				<scen:parameter name="name" value="slave" />
				<scen:parameter name="parent" value="roaming" />
				<scen:parameter name="java-code" value="StringFunctions" />
				<scen:parameter name="knowledge" value="masterAgent -is> master" />
			</scen:agent>
		</scen:container>
	</scen:initial>
	<scen:timeline>
		<scen:event time="2000">
			<scen:CLAIMMessage>
				<scen:to>root</scen:to>
				<scen:content>( struct message go-gather-root roaming )</scen:content>
			</scen:CLAIMMessage>
		</scen:event>
	</scen:timeline>
</scen:scenario>
